sudo lsusb -vv -d 057e:

Bus 001 Device 003: ID 057e:2009 Nintendo Co., Ltd
Device Descriptor:
  bLength                18
  bDescriptorType         1
  bcdUSB               2.00
  bDeviceClass            0 (Defined at Interface level)
  bDeviceSubClass         0
  bDeviceProtocol         0
  bMaxPacketSize0        64
  idVendor           0x057e Nintendo Co., Ltd
  idProduct          0x2009
  bcdDevice            2.00
  iManufacturer           1 Nintendo Co., Ltd.
  iProduct                2 Pro Controller
  iSerial                 3 000000000001
  bNumConfigurations      1
  Configuration Descriptor:
    bLength                 9
    bDescriptorType         2
    wTotalLength           41
    bNumInterfaces          1
    bConfigurationValue     1
    iConfiguration          0
    bmAttributes         0xa0
      (Bus Powered)
      Remote Wakeup
    MaxPower              500mA
    Interface Descriptor:
      bLength                 9
      bDescriptorType         4
      bInterfaceNumber        0
      bAlternateSetting       0
      bNumEndpoints           2
      bInterfaceClass         3 Human Interface Device
      bInterfaceSubClass      0 No Subclass
      bInterfaceProtocol      0 None
      iInterface              0
        HID Device Descriptor:
          bLength                 9
          bDescriptorType        33
          bcdHID               1.11
          bCountryCode            0 Not supported
          bNumDescriptors         1
          bDescriptorType        34 Report
          wDescriptorLength     203
         Report Descriptors:
           ** UNAVAILABLE **
      Endpoint Descriptor:
        bLength                 7
        bDescriptorType         5
        bEndpointAddress     0x81  EP 1 IN
        bmAttributes            3
          Transfer Type            Interrupt
          Synch Type               None
          Usage Type               Data
        wMaxPacketSize     0x0040  1x 64 bytes
        bInterval               8
      Endpoint Descriptor:
        bLength                 7
        bDescriptorType         5
        bEndpointAddress     0x01  EP 1 OUT
        bmAttributes            3
          Transfer Type            Interrupt
          Synch Type               None
          Usage Type               Data
        wMaxPacketSize     0x0040  1x 64 bytes
        bInterval               8
Device Status:     0x0001
  Self Powered


001:003:000:DESCRIPTOR         1537220049.688493
 05 01 15 00 09 04 A1 01 85 30 05 01 05 09 19 01
 29 0A 15 00 25 01 75 01 95 0A 55 00 65 00 81 02
 05 09 19 0B 29 0E 15 00 25 01 75 01 95 04 81 02
 75 01 95 02 81 03 0B 01 00 01 00 A1 00 0B 30 00
 01 00 0B 31 00 01 00 0B 32 00 01 00 0B 35 00 01
 00 15 00 27 FF FF 00 00 75 10 95 04 81 02 C0 0B
 39 00 01 00 15 00 25 07 35 00 46 3B 01 65 14 75
 04 95 01 81 02 05 09 19 0F 29 12 15 00 25 01 75
 01 95 04 81 02 75 08 95 34 81 03 06 00 FF 85 21
 09 01 75 08 95 3F 81 03 85 81 09 02 75 08 95 3F
 81 03 85 01 09 03 75 08 95 3F 91 83 85 10 09 04
 75 08 95 3F 91 83 85 80 09 05 75 08 95 3F 91 83
 85 82 09 06 75 08 95 3F 91 83 C0
